title,sub_title,writer,published_date,thumbnail_img,content,html_content,imgs
"행복, 우리 모두의 목표",,,2023.03.15 15:07,https://cdn.econoi.com/news/photo/202303/33615_13422_513.jpg,",풍요로움, 부유함, 평화로움, 즐거움, 건강함, 보람참, 존경받음, 사이좋음…. 물질적인 것부터 정신적인 것까지, 스스로 획득하는 것에서부터 사회가 제공하는 것까지. 이 많은 단어를 하나의 이름으로 모아 부르면 무엇이 될까요? 행복입니다. 우리 모두의 목표이죠. 사람은 누구나 행복하게 살고 싶어 합니다.,,유엔 총회는 ‘세계인의 삶에서 행복이 얼마나 중요한지 다시금 인식하자, 행복해지자’는 뜻을 담아 2012년 ‘국제 행복의 날 (International Day of Happiness)’을 만들자는 데 동의했어요. 2013년부터 매년 3월 20일을 기념일로 삼고 여러 행사를 개최합니다. 오늘은 국제 행복의 날을,로 좀 더 자세히 살펴봅시다.,▶난 어떤 때 행복하다고 느끼나요? 가족과 친구의 생각도 알아봐요.,▶우리가 더 행복해지기 위해서는 무엇이 필요할까요?,▶가족·친구와 함께 ‘행복을 표현하는 사진’을 구상하고 찍어보세요.,UN 국제 행복의 날 공식 웹페이지(https://www.,un.org/en/observances/ happiness-day)에 접속해 보세요.,을 감상할 수 있습니다. 언제, 어디서 찍은 건지도 나와 있어요. 2012년 뉴욕에서 우리나라의 가수 싸이와 반기문 전 UN사무총장이 함께 찍은 사진도 뽑혔어요! 사람들의 웃음을 통해 행복을 생각해봐요.,2015년. UN은 사람들의 삶을 더욱 행복하게 만들고 삶의 질을 높이기 위해 지속가능한 개발, 빈곤 퇴치, 행복과 복지를 증진시키는 경제성장이 필요하다는 결론을 내렸습니다. 이를 위해 17가지 목표를 정했는데, 이것이 유명한,(SDGs)예요. 이 개념에 관해서는 나중에 어린이 경제신문이 좀 더 쉽고 재미있게 알려드릴게요.,국제 행복의 날을 상징하는 또 다른 재미있는 이야깃거리가 있어요. 바로 ‘세계 행복 보고서(World Happiness Report)’입니다. 2012년 처음 시작되어 매년 국제 행복의 날에 맞춰 발표되고, 올해 11 번째를 맞이했죠.,세계 행복 보고서는 UN 산하 자문기구인 지속가능발전해법네트워크라는 곳이 만듭니다. 나라별 1천여 명에게 삶의 만족도를 조사하는 갤럽의 설문 조사 결과와 각국의 GDP, 기대수명, 부정부패 정도 등 여섯 가지 정보를 종합하여,하죠.,우리나라의 2022년 세계 행복 순위는 59위, 삶의 평균 평가 점수는 10점 만점에 5.935점이었어요.,또한 작년 보고서에서는 팬데믹의 영향으로 힘겨웠던 반면 사회적 지원도 늘어나 서로를 돕는 모습이 눈에 띄었다는 분석이 관심을 받았습니다.,올해 보고서는 3월 20일에 발표됩니다. 어떤 내용이 실려있을지 궁금해지네요!",,
봄철 ‘산불됴심’의 어제와 오늘,반사경,,2023.03.15 15:37,https://cdn.econoi.com/news/photo/202303/33615_13422_513.jpg,"산불됴심’ 비석이에요. 경상북도 문경시 조령(鳥嶺)에 있어요. 지금부터 200년쯤 전인 조선 영·정조 임금 때 세운 것으로 추정하는 유물이죠. 옛날 사람들도 나무의 소중함을 잘 알고 있었다는 증거예요.,지금 우리가 쓰는 ‘산불조심’과 한 글자 다르지만, 산불을 조심해서 숲을 보호해야 한다는 의지는 그때나 지금이나 달라진 게 없어요.,나무를 아예 베지 못하도록 한 역사도 있어요. 금송령(禁松令)이에요. ‘소나무 베는 것을 금지한다’는 뜻이죠. 소나무로 군대에서 사용하는 배를 만들고, 궁궐 건축에도 쓰이기 때문에 함부로 베지 못하게 했어요.,뜻은 조금 다르지만, 나무를 잘 가꾸자는 마음과 실천 의지는 통해요.,최근 뉴스를 보면 산불 소식이 부쩍 많아요. 산불재난 국가위기경보 ‘경계’ 단계가 발령 됐다는 소식도 들려요. 산불로 오랫동안 자란 나무들이 한순간에 잿더미로 변하는 것을 보면 안타까워요. 불타버린 산이 제 모습을 찾으려면 수십 년의 시간이 필요합니다.,임금님이 살던 궁궐도 화재에서 자유롭지 못했어요. 건물 대부분을 나무로 지었으니, 한번 불이 나면 산불만큼이나 위험했죠.,그래서 오늘날 소화전과 비슷한 역할을 하는 장치를 마련해 두었어요. 바로 ‘드므’ 입니다.,드므의 구성은 아주 단순해요. 큰 무쇠솥에 물을 채워두고, 중요한 건물 모퉁이에 설치해 두었죠. 그런데 큰불이 나면 여기에 있는 물로는 진화할수 없었어요. 우리 조상도 그 사실을 잘 알고 있었죠. 그럼 왜 드므를 설치 했을까요.,상징적 의미가 강해요. 이 물로 불을 끈다기 보다, 불귀신이 물에 비친 자기 얼굴을 보고 놀라서 스스로 달아나라는 주술의 의미를 담았어요. 물론 드므에 담긴 속 뜻은 드므를 보고 늘 화재 예방에 신경쓰라는 것이었어요.,드므와 ‘산불됴심’ 비석은 같은 메시지를 주고 있어요. 궁궐에 가면 꼭 드므를 찾아보고, 불조심에 대한 조상들의 경각심을 되새겨 보세요.,지난 해(2022년) 발생한 산불은 740건. 피해 면적은 약 2만 5,000ha 입니다. 축구장 하나가 0.7ha 정도. 계산해보면 축구장 35,000개가 불에 타 사라진 셈이에요.,이렇게 비교하니 산불 피해가 엄청나죠? 놀라긴 아직 일러요. 피해 액수는 무려 1조 3,452억 원입니다. 너무나 큰 손실이에요. 특히 최근 몇년 사이에 산불이 늘어나고, 대형 산불(피해 면적 100ha 이상)도 증가하는 게 걱정스럽습니다.,,산림청에 물어봤어요. 산불 발생의 99%는 사람의 부주의 때문이라고 해요. 여기에 기후 위기가 심해지면서 가뭄이 길어지는 것도 문제로 꼽혀요. 오랜 시간 건조한 산속에서 큰불이 날 가능성은 그만큼 커지는 거죠. 이는 수치로도 확인돼요. 10년 전(2013년) 대형 산불은 1건에 그쳤지만, 지난해는 무려 11건이나 발생했어요.,정리하면, 사람의 실수와 기후 위기가 산불을 더 크게 만들고 있어요. 기후 위기를 해결하려면 여러 가지 방법이 있지만, 우리가 실천할 수 있는 가장 적극적인 방법은 나무를 심고 가꾸는 것이에요. 주변에서 쉽게 볼 수 있는 소나무 1그루는 1년에 6kg 정도의 탄소를 흡수할 수 있어요.,마침 4월 5일 식목일이 다가 오고 있어요. 올해 식목일 즈음에는 여러분도 ‘탄소를 흡수하는 나무’를 생각하며 나무 심기에 나서는 것은 어떨까요? 시민단체 ‘생명의 숲’(https://forest.or.kr)도 추천합니다. 나무심기와 숲 가꾸기 후원도 할 수 있어요.",,
"‘조건’ 지켜야 보조금, ‘미국 최우선 주의’",시끌벅적 경제뉴스,,2023.03.15 15:12,https://cdn.econoi.com/news/photo/202303/33615_13422_513.jpg,"전국 방방곡곡에서, 바다 건너 머나먼 나라에서. 세계 곳곳에서 다양한 경제 뉴스가 들려오는 요즘. 조금 더 자세히 살펴볼 만한 뉴스 몇 가지를 골라 봤어요. 무슨 소식인지, 어떤 의미가 있는지 차근차근 살펴봅시다.,,지난 2월 28일, 미국 정부가 일명 ‘반도체과학법’에 따른 보조금 정책을 발표했어요. 반도체 제조 업체들이 공장을 새로 짓고, 기술을 개발하고, 원활하게 생산에 나설 수 있도록 한국 돈으로 50조 원을 넘는 막대한 지원금을 편성한다는 내용이었습니다.,기업들이 두 손 다 들고 환영할 법한 소식인데, 왜인지 당황하는 기색이 역력해요. 삼성전자, SK하이닉스 등 우리나라를 대표하는 반도체 기업들도 손익을 계산하느라 머리를 쥐어짰다는 분석이 나옵니다. 이유가 뭘까요?,,미국이 발표한 막대한 지원금을 받을 수 있다면, 반도체 기업들은 그야말로 ‘살판’이 날 거예요. 한 기업이 모든 지원금을 받을 수야 없겠지만, 넉넉한 보조금으로 제품 가격을 낮춰 경쟁력을 높일 수 있을 겁니다. 대출받은 자금으로 새로운 생산시설을 적은 부담으로 만들 수 있을 겁니다. 더욱 좋은 반도체를 개발해 미래 경쟁력을 키울 수도 있겠죠.,그야말로 예쁘고 향기 좋은 장미꽃 같은 이 지원금. 우리 집 화단(기업)에 들여놓고 싶은데, 문제가 있습니다. ‘가시’가 정말 보통이 아니에요.,날카로운 건 물론, 거의 독이 있는 수준이죠.,,미국이 발표한 새 정책에 따르면, 반도체 제조 기업들이 지원금을 받으려면 여러 조건을 충족해야만 합니다. 그 가운데 일부를 살펴보면 다음과 같아요.,① 기준 이상 보조금을 받은 기업이 기대 수익을 크게 넘어 돈을 벌면, 지급한 보조금을 최대 75%까지 미국 정부가 회수함,② 공장을 건설할 때 미국산 철강과 건축자재만 사용할 것,③ 미국 정부에 재무보고서를 제출하고 검증받을 것,④ 보조금을 받은 기업은 중국에 반도체 시설을 짓거나, 중국 기업과 협력하는 등 중국과 관련한 첨단기술 투자가 10년간 금지됨,⑤ 기준 이상 보조금을 받은 기업은 직원에게 고품질의 반도체 인력 양성 교육을 마련해야 하고, 보육 서비스를 제공해야 함 등.,이외에도 조금 더 있어요!,,슬쩍 보기만 해도 머리가 다 아프네요. 이렇게 복잡하고, 만만찮은 조건을 줄줄이 단 이유가 뭘까요? 국가경쟁력입니다.,‘미국 최우선’이 선명하게 드러난 새 정책. 기업들은 어떻게 해야 할지 열심히 계산기를 두드리고 있어요. 예를 들어, 한국 기업은 중국과의 교류를 차단하는 ④번 조건의 부담이 큽니다. 미국 기업이라 해도 초과이익을 정부가 거둬가겠다는 ①번 조건 때문에 떨떠름해요. 오죽하면 ‘아예 보조금을 받지 않는 방안도 고려하자’는 의견도 있죠.,그렇지만 미국 정부가 내건 보조금과 대출 등 지원책이 탐나는 것은 사실입니다.,미래 산업의 핵심 부품인 컴퓨터 칩을 두고 기업과 기업, 나라와 나라 간의 경쟁이 치열하게 벌어지고 있어요. 우리나라도 뒤처지지 않기 위해 많은 노력이 필요해 보입니다.,,지난 2월 중순, 농림축산식품부와 농협이 손을 잡고 국산 소고기를 할인해서 판매하는 행사를 열었어요. 이 행사는 큰 인기를 끌었죠. 그런데, 왜 평소에는 이렇게 싸게 판매하지 못할까요?,이 할인 이벤트가 열린 건 최근 한우 공급이 수요에 비해 너무 많아 도매가격이 떨어졌기 때문이래요. 생산자인 농민이 판매하는 도매가격이 낮아졌으면, 굳이 할인행사를 열 것 없이 소비자가 구매하는 소매가격도 그만큼 낮아져야 하는 것 아닐까요?,,① 생산기간 :,기르는 데 오랜 기간이 걸리니 사료 등으로 많은 비용이 들고, 거래 가격이 높게 형성되기 쉬워요. 일정 수준 아래로 가격이 내려가기도 어렵죠.,② 유통비용 : 복잡한 유통과정에서 가격이 많이 올라요. 한 분석에 따르면, 농민이 한우를 판매한 뒤 고기로 가공되어 소비자에게 도달하는 유통과정에서 거의 절반에 달하는 금액이 더해진다고 해요. 그 원인으로는,너무 많은 단계를 거치면서 가격이 비싸진다는 뜻.,이 문제를 해결하려면 한우의 유통구조 자체를 고쳐가야 해요. 그렇지만 우리나라가 모든 것을 정부가 결정하는 계획경제 국가가 아닌 이상, 손쉽게 해결할 수있는 문제가 아니죠. 유통과정의 상인들도 국민이며, 경제 주체이니까요. 한우 할인 뉴스 뒤에 숨겨진 고민. 생각보다 복잡하죠?",,
음료수 용량의 비밀 ① 알고 보면 역사적 유래 있어,길거리 경제,,2023.03.22 13:19,https://cdn.econoi.com/news/photo/202303/33615_13422_513.jpg,"흔히 보는 야쿠르트,큰 용량도 있지만, 여전히 이 크기가 가장 많이 팔려요. 왜 이렇게 감질나게 만들었죠?,이야기는 오래전으로 거슬러 올라갑니다. 야쿠르트를 처음 만든 곳은 일본. 지금으로부터 75년 전인 1949년에 탄생했어요. 우리나라에 들어온 것은 1970년쯤. 당시에는 집집마다 냉장고가 없어서, 우유를 가공해서 만든 야쿠르트를 신선하게 보관하기 어려웠어요. 마시다 남기거나 기온이 올라가면 상하기 쉬웠죠. 그래서 제조사는 ‘한 번에 마시기 적당한 양’만 팔기로 했어요. 바로 지금 크기입니다. 65㎖ 용기에는 유산균 약 200억 마리가 들어있다고 해요. 하루 권장량은 1억~100억 마리. 이 크기로 충분하다는 것도 ‘작은 용기’의 이유입니다.,‘뚱캔’ 콜라 용량은,5㎖가 더 들어간 건가요, 빠진 건가요? 한국코카콜라의 답변은 의외예요.,콜라는 140여 년 전인 1886년 미국에서 처음으로 등장했어요. 탄산 음료라는 상품 자체가 낯선 때였죠. 톡 쏘는 맛에 김이 빠지면 맛이 없는 콜라와 닮은 건 맥주 정도였어요. 그래서 콜라를 가장 비슷한 맥주병에 넣어서 팔기 시작했습니다. 당시 널리 쓰이던 맥주병 용량은 12온스(Oz).,㎖로 바꾸면 354.88㎖, 반올림하면 355㎖. 그 전통이 지금까지 이어지는 것으로 보인다는 게 한국코카콜라의 설명입니다.,식혜는 콜라보다 특이해요. 용량이,특이한 것은 캔의 둘레나 높이는 콜라 캔과 같다는 점. 너무나 궁금해서 식혜를 만드는 음료 회사에 물어보니 ‘질소 충전’ 때문이래요.,식혜는 밥알이 들어가고, 탄산음료와 달라 상하기 쉬워요. 그래서 질소를 넣어줘야 합니다. 질소가 용량의 일부를 차지하다 보니 들어가는 식혜는 그만큼 조금씩 줄어들게 된다고 해요. 용기 크기는 비슷한데, 일반 탄산음료보다 용량이 조금 적은 이유죠. 참고로, 식혜의 짝꿍인 수정과도 같은 이유로 탄산음료보다 조금 적은 용량으로 팔리고 있답니다.,,소주의 용량과 관련한 유명한 이야기가 있어요. 소주 한 병을 소주잔에 따르면 7잔 반이 나온다는 것. 그러면 한 잔을 채우기 위해 한 병을 더 주문해야 하니, 판매를 늘리는 고도의 마케팅 전략이라는 설명이죠.,정말 그런지 소주 회사에 전화해봤어요. ‘사실과 다르다’고 하네요.,지금 같은 소주가 처음 나온 것은 100년 전인 1924년. 당시 소주 한 병은 2홉이었어요.,‘홉’은 우리나라에서 1902년까지 쓰던 부피 단위로, 1홉은 약 180㎖입니다. 시간이 흘러 ‘홉’이 사라지고, 그 자리를 ㎖가 차지했어요. 2홉을 계산하면 360㎖가 되고, 그게 지금의 소주병 용량이 됐다는 설명이에요. 오늘의 결론! 세상에 이유 없는 것은 없어요. 우리 주변을 좀 더 눈여겨보세요. 새로움이 보일 것입니다.",,
어니스트 기자단 · 금교잇 특파원 합동 기자회견 “생활 속 체험으로 경제 배우세요”,,,2023.04.12 15:49,https://cdn.econoi.com/news/photo/202303/33615_13422_513.jpg,"어린이가 왜 경제 공부를 해야 한다고 생각하시나요?,,어른이 되면 큰돈을 다루게 돼요. 쉽게 말해볼까요. 두발자전거를 잘 타려면 어떻게 하죠? 어릴 때부터 세발, 네발자전거를 타다 보조 바퀴를 떼고 두발자전거를 타게 되죠. 돈도 마찬가지예요. 적은 돈부터 연습을 해봐야 많은 돈도 잘 다룰 수 있어요.,<어린이 경제신문> 2023 어니스트 기자단과 금교잇 특파원의 합동 기자회견이 지난 29일(수) 화상 형식으로 진행됐다. 인터뷰 대상은 교실 미니국가인 ‘빵국’의 대통령, 박정현 선생님. 현직 초등 교사이자, 어린이 경제 관련 도서를 여러 권 펴낸 작가이기도 하다.,박 선생님은 담임을 맡은 학교에서 학생을 위한 체험형 교육인 ‘스쿨 오브 머니’를 운영하고 있다. 미나국가와 화폐도 도입했다. 30여 명의 어린이가 참가한 인터뷰 내용을 소개한다.,기자회견에 앞서 진행된 짧은 강의에서 박 선생님은 1/3 법칙을 강조했다. 자신의 수입을 저축과 소비, 투자 세 가지로 나누어야 한다는 것. 여기서 핵심은 ‘소비’하고 남은 금액을 저축하는 것이 아니라, ‘저축’이 먼저여야 한다는 점이다. 아울러 인플레이션에 대응하기 위한 ‘투자’의 필요성도 소개했다.,,경제 공부의 첫걸음은 뭐라고 생각하시나요?,,경제 공부의 시작은 쉬운 데서부터 출발해야 한다고 생각해요. 예를 들어볼게요. 치킨이 2만 원인 이유를 아는 사람 있어요? 최근에는 가격이 3천 원 올랐어요. 이처럼 일상생활에서 돈과 관련된 것에 관심을 갖는 것이 경제 공부의 첫걸음이라고 생각해요. 당연한 것을 당연하지 않은 시각으로 바라보는 연습을 해보세요. 그것이 경제 공부의 시작이 될 수 있어요.,,투자라는 게 되게 어렵게 느껴져요. 잘하면 돈을 벌지만, 잘못하면 손해를 볼 수도 있고요. 어떻게 해야 투자를 잘 할 수 있을까요?,,사람들은 투자라는 말을 들으면 주식, 부동산 같은 단어를 떠올려요. 하지만 투자는 사람마다, 그리고 나이마다 달라요. 여러분 나이대에는 자기 자신에게 하는 투자가 가장 중요하다는 걸 꼭 기억하세요. 스스로에 대한 투자는 ‘잘하는 것’을 찾는 데서 시작해요. 그것을 찾게 되면 많은 시간과 노력을 쏟아서 능력을 키워가세요.,,스쿨 오브 머니 활동을 하면서 어려운 점은 무엇이었나요?,,경제는 그 자체로 복잡해요. 항상 변수가 존재하고요. 예측이 어렵죠. 실업자가 생기고, 인기 많은 물건이 동나기도 해요. 하지만 그것을 통해 배우는 것도 많아요.,,어른들은 돈을 벌면 세금을 내잖아요, 교실에서도 그런가요?,,물론이에요. 소득의 10%를 세금으로 내요. 세금은 나중에 학급행사에 사용할 예정이에요.,",,
