title,sub_title,writer,published_date,thumbnail_img,content,html_content,imgs
창립 22주년 특별 기획 ‘대한민국 미래 찾기’ ①,‘한국식 핫도그’에 담긴 한류와 한국화 (상),,2023.06.21 16:08,https://cdn.econoi.com/news/photo/202306/40243_20360_41.jpg,"2001년 6월 22일. <어린이 경제신문>을 만드는 회사가 세상에 태어난 날이다.,창립 22주년. 22일에 22주년을 맞는 뜻깊은 해이다. 22년 전, ‘어린이도 읽는 경제신문’으로 창업하겠다고 했을 때, 많은 사람이 보였던 반응이다.,“어떻게 ‘안 되는 것 세 가지’를 모으려 하는가? 실패할 수밖에 없는 조합이다.”,‘어린이는 줄고, 경제는 어렵고 시장도 없으며, 종이 신문은 쇠퇴하는’ 상황을 빗댄 말이다. 실제로 22년을 힘들게 보냈다. 초기 반응처럼 ‘세 가지 어려움’을 그대로 겪었다.,그렇지만, 독자의 관심과 지원을 받아 자라난 어경이는 어린이 신문과 경제 교육에서 새 시대를 열고 있다는 평가를 받고 있다.,이 경험을 바탕으로 지금 어려움을 겪는 한국 경제, 불안해하는 어린이의 미래를 생각해 본다. 어떻게 하면 더욱 좋은 미래를 만들 수 있을까. 작지만 소중한 것에서 대답을 찾는 기획 기사를 마련했다.,첫 번째 이야기는 ‘한국식 핫도그’에서 찾는 우리의 미래다.,,한국 길거리 음식의 대명사인 ‘핫도그’가 미국 뉴욕, LA 등지에서 좋은 반응을 얻고 있다. 고객들이 줄 서서 먹을 정도로 인기를 끌면서 뉴욕에만 한국식 핫도그(미국식의 싸 먹는 핫도그가 아니라 막대기에 꽂아서 튀겨 만드는 핫도그) 매장이 10개나 들어섰다.,,영국 런던 중심부에 있는 ‘BUNSIK’(분식, 한국어 그대로 사용)은 항상 대기 줄이 있다. 이름 그대로 한국의 분식을 파는 곳인데, 영국인들의 폭발적인 반응으로 ‘줄 서는 집’으로 유명해졌다. 주력 상품은 다양한 핫도그.,,JTBC에서 인기를 끌고 있는 프로그램인 ‘한국인의 식판’. 외국에서 단체 급식을 통해 한식을 소개한다. 식사 후 평가에서 90% 이상이 ‘좋다’고 평가한다. 지난 10일에는 영화 미나리에 나온 앨런 킴의 태권도장 친구들에게 분식을 선보였다. 여기서 “평생을 먹을 수 있다”라고 평가받은 메뉴가 한국식 핫도그다.,우리에게는 길거리 음식으로, 지나칠 정도로 평범한 먹거리인 ‘막대에 꽂힌 한국식 핫도그’. 이 핫도그가 세계에서 인기를 끌 수 있는 상품임을 이 세 사례가 잘 보여준다.,한국형 핫도그의 무엇이 외국 소비자들이 줄을 서가며 기다리게 하는 걸까.,세계를 휩쓴 한류 유행을 통해 한국 문화, 한국 먹거리는 인기 상품으로 떠올랐다. 한국식 핫도그는 오래전부터 우리의 길거리 음식이었지만, 주목받지 못하다 한류의 유행을 발판으로 관심 대상이 됐다. 즉, 세계인들이 접하게만 할 수 있다면 더욱 많은 한국 문화와 음식, 상품이 외국 인을 푹 빠지게 할 수 있다는 뜻이다.,과장이라고 생각한다면, 최근 방송가에 부는 한식 프로그램 열풍을 살펴보자.,tvN의 ‘장사 천재 백사장’은 한식당이 하나도 없는 이탈리아 나폴리에서 순수 한국식 으로 현지인을 줄 세우는 프로그램이다.,JTBC의 ‘한국인의 식판’은 단체 급식을 ‘외국인도 반하는 고급 먹거리’로 바꿨다.,두 프로그램은 한국 음식에 대한 외국인 소비자의 반응을 생생하게 보여주며 좋은 반응을 얻고 있다.,한국식 핫도그는 미국에서 뿌리를 찾을 수 있다. 이름의 유래인 ‘핫도그’는 빵 사이에 소시지와 채소를 넣은 음식. 음식 형태는 ‘콘도그’에 가깝다. 소시지에 옥수수 가루를 덮어 튀기는 음식으로, 둘 다 빵의 한 종류다.,우리는 두 음식에서 각각 재료를 가져왔다. 전자에서는 이름을 가져왔고, 후자에서는 소시지를 가져오되 옥수수 대신 밀가루와 튀김가루를 사용해 식감이 훨씬 좋아진 먹거리를 만들어냈다. 튀김옷과 소시지에 다양한 재료를 추가해 종류를 늘려서 새로운 먹거리 영역으로 확장시켰다.,이제 미국으로 역수출된 한국식 핫도그는 현지에서 폭발적인 반응을 얻고 있다.,소비자들은 ‘한국식 핫도그’를 그간 익숙하게 먹어온 핫도그도, 콘도그도 아닌 전혀 새로운 먹거리로 받아들이고 있다.,한국식 핫도그는 미국 음식을 단순하게 모방하지 않고, 새로운 아이디어와 요리법을 더해 새로운 상품으로 거듭났다. 경제학에서 말하는 ‘창조적 파괴’다.,푸석푸석한 옥수수빵의 재료를 바꿔 쫀득한 식감으로 변형시켰다. 국적에 상관 없이 다들 좋아하는 ‘단짠단짠’(달고 짠맛의 조화)으로 맛을 구성했다. 무엇보다 두 손으로 받쳐야 먹을 수 있고 내용물도 흘리기 쉬운 미국식 핫도그를 벗어나, 나무 막대기 하나를 꽂아 편의성을 극대화했다. 야구장, 농구장 등 응원이 뒤따르는 경기장에서 먹기 편한 한국식 핫도그가 큰 인기를 끄는 사례가 늘어나는 비결이다.,한국식 핫도그를 다시 보자. 어렵게 처음부터 만들어내는 ‘창조’만 아니라, 기존의 것을 변형시키고 발전시키는 ‘창의’도 성공에 이르는 좋은 길이라는 것을 잘 보여준다.",,https://cdn.econoi.com/news/photo/202306/40243_20360_41.jpg
첨단(尖端),한자로 만나는 경제,,2023.06.23 17:52,https://cdn.econoi.com/news/photo/202306/40243_20360_41.jpg,",첨단기술, 첨단 인공지능(AI)··· 많이 들어본 말이죠? 첨단은 ‘뾰족한 끝’이라는 뜻이에요. 경제·기술·유행 같은 분야를 맨 앞에서 이끄는 것을 가리키죠.,남들이 미처 생각하지 못한 길을 찾아내야 앞설 수 있어요. 그러려면 날카로운 관찰력이 필요해요. 또 포기하지 않고 끝까지 가겠다는 끈기도 중요해요. ‘첨단’이란 두 글자에 이 뜻이 모두 담겨있네요!,,이 글자는 참 재미있게 생겼어요. 윗부분 ‘작을 소’(小)자, 아래의 ‘큰 대’(大)자가 합쳐진 모양이죠. 필통 속 연필을 꺼내 보세요. 동화 속 궁전의 뾰족지붕을 떠올려도 좋아요. 위쪽은 작고 좁은데, 아래쪽은 크고 두꺼워지죠? ‘뾰족할 첨’(尖)자는 이처럼 ‘뾰족하다’는 특성을 재치 있게 담아냈어요.,(예) 수출의 첨병.,,(예) 의견이 첨예하게 대립하는 상황이었다.,,(예) 교회 첨탑 위 십자가.,,글자를 좌우로 나눠 보세요. 오른쪽 글자는 ‘끝 단’(耑)자. 식물의 모습을 본떴다고 해요. 윗부분 ‘山’이 줄기와 잎사귀, 아래의 ‘而’는 뿌리를 나타냈어요. 뿌리는 식물의 끝, 그래서 ‘끝’이라는 뜻이 생겼죠.,왼쪽은 여러분도 아는 ‘설 립’(立)자. 사람이 땅 위에 두 다리 를 딛고 선 모습이에요. 이 글자는,예요. ‘立’에서 ‘(바르게) 서 있다’는 뜻을, ‘耑’에서 ‘단’이라는 소리 (음)를 하나씩 가져왔어요.,그런데 비슷한 생김새 때문에, 사람들은 ‘바를 단(端)’자와 ‘끝 단’(耑)자를 섞어 쓰기 시작했어요. 결국 ‘端’은 지금처럼 두 가지 뜻을 모두 갖게 되었지요.,(예) 탐정은 단서를 찾아냈다.,,(예) 그 학생은 품행이 단정합니다.,,(예) 새로 산 바지 하단을 잘라 길이를 줄였다.",,https://cdn.econoi.com/news/photo/202306/40258_20382_4458.png
소비자 ‘바가지요금’ 불만 급증,꼭!Easy 경제,,2023.06.21 17:00,https://cdn.econoi.com/news/photo/202306/40243_20360_41.jpg,",바가지요금 /,지방자치단체 축제에서 불합리한 가격의 상품 판매가 잦아 논란 /,가격을 올려도 수요(구매하고자 하는 쪽)가 있기 때문,기나긴 코로나19 사태가 끝나면서, 그동안 열리지 못한 축제가 전국 곳곳에서 열리고 있습니다.,주요 명소에도 관광객이 늘어나고 있죠.,그런데 사람이 몰리면서 차량 정체, 무질서, 쓰레기 등 여러 문제가 발생하고 있어요. 그 가운데 하나가 바가지요금입니다.,축제 현장마다 이 문제로 소비자와 판매자 사이에 갈등이 생겨요. 왜 이런 일이 생길까요? 막을 수는 없나요?,,뉴스에 나온 것만 살펴보죠. 전남 함평군에서 열린 ‘나비 대축제장’에서 어느 상인이 어묵 한 그릇을 1만 원에 판매했어요. 너무 비싸다며 5천 원어 치를 요구한 고객이 거절당하는 모습이 고스란히 전파를 탔어요. 진해 군항 제에서는 5만 원을 내고 바비큐를 주문했지만, 가격에 비해 양이 턱없이 모자랐던 사실이 알려져 거센 비난을 받았어요. 또한 KBS의 한 프로그램에서 상인이 옛날 과자 한 봉지에 7만 원을 요구하는 모습이 방송되면서 바가지 요금 문제가 다시금 주목을 받았습니다.,가격은 수요(구매하려는 쪽)와 공급(판매하려는 쪽)에 따라 결정됩니다. 관광 성수기나 축제 시즌이면 많은 관광객이 특정한 장소에 몰려듭니다. 이런 상황에서 방문객에게 꼭 필요한 먹거리와 숙박 서비스는 절로 부족해져요. 공급은 한정되는데 갑자기 수요가 급증하는 상황. 이 때문에 가격이 올라도 소비자 수요가 계속 늘고, 결국 가격이 더욱 오를 수 있는 환경이 만들어집니다. 평소보다 비교할 수 없이 상품이 비싼 ‘바가지요금’이 형성되는 거예요.,■ 그림을 볼까요. 오른쪽으로 갈수록 아래를 향하는 수요곡선(가격 기준, 가격이 오르면 수요량이 감소)과 오른쪽으로 갈수록 위를 향하는 공급곡선(가격 기준, 가격이 오르면 공급량이 증가)이 있어요. 두 곡선이 만나는 지점이 바로 (균형) 가격입니다.,■ 처음 가격은 <수요곡선 1>과 <공급곡선>이 만나는 <A> 지점입니다. 그런데 축제로 관광객이 늘어나면서 수요가 증가하고, 수요곡선 자체가 위로 올라가요.,그래프에서 새로운 <수요곡선 2> 가 이 상황을 나타내죠. 이제 <수요곡선 2>와 변함이 없는 <공급곡선>이 만나 새 가격을 형성합니다. 바로 <가격 B>입니다. 처음과 비교하면 거래 가격이 올랐다는 사실을 알 수 있어요. 수요곡선이 올라갈수록 거래 가격도 점점 더 올라가게 됩니다.,물건 가격이나 요금을 실제보다 비싸게 지불하는 것을 ‘바가지를 쓰다’라고 표현합니다. 왜 하필 바가지일까요? 조선시대 중국에서 들어온 말로 ‘십인계’란 노름에서 단어가 유래 했다는 설이 가장 유력합니다. 십인계는 1~10까지 적힌 바가지를 엎어놓은 다음 물주(게임을 운영하는 사람)가 마음대로 숫자를 부릅니다. 외친 숫자가 적힌 바가지에 돈을 건 사람이 못 맞춘 사람들의 돈을 가지고 가는 것이죠. 아무도 맞추지 못하면 모두 물주의 차지입니다. 이런 노름에서 최후의 승자는 보통 물주입니다. 참여한 사람들은 대부분 돈을 잃죠. 이로 인해 노름에서 돈을 잃는 상황을 ‘바가지 썼다’라고 표현하게 됐습니다.,지역 축제나 여름휴가철마다 되풀이하는 음식값이나 숙소의 바가지 논란. 막을 수 없을까요?,결론부터 말하자면 막을 수 없어요. ‘막는다’는 것은 불법을 다스린다는 뜻인데, 바가지요금은 불법이 아니기 때문입니다.,이런 일이 생기면 지자체는 “가격 결정은 판매자 권한이다. 행정력을 동원해 바가지요금을 받지 않도록 ‘행정지도’(소방, 교통 등 간접적인 규제로 바가지요금을 받지 못하게 부담을 주는 것)를할 수 있지만 인력이 부족하다”라고 말합니다.,우리나라는 대부분의 상품과 서비스에서 ‘오픈 프라이스 제도’를 도입하고 있어요. 가격 결정을 판매자 마음대로 할 수 있다는 뜻이죠. 예를 들어, 숙소나 캠핑장, 놀이공원에는 ‘주말과 휴일, 성수기에 가격이 오른다’는 표시가 있어요. 가격 결정권이 판매자에게 있다는 말입니다.,현재로선 상인들이 자발적으로 바가지요금을 없애는 것(상인들의 선의)만이 해법입니다. 바가지요금이 불법은 아니지만, 상도의에 어긋난 행위로 도덕적 비난의 대상이 될 수 있어요. 이에 지역이나 상인의 이미지가 나빠지고, 불만이 쌓여 소비자가 떠나갈 수 있습니다. 그러니 짧은 이윤을 추구하다 오히려 큰 손실을 볼 수 있다는 위기의식을 가져야 해요. 소비자들이 문제가 있는 지역이나 상인의 정보를 공유하고, 가능한 한 이용하지 않는 것도 바가지요금을 줄이는 방법이에요.,글·그림 박희정 어니스트 (어린이 경제신문 경제교육 지도사 / NIE 전문 강사)",,
"수학여행, 이제 바꾸자(하) 같은 비용으로 남다른 ‘수학여행’",길거리 경제,,2023.06.21 16:52,https://cdn.econoi.com/news/photo/202306/40243_20360_41.jpg,"지난 5월 24일, D학교는 2박3일 일정으로 수학여행을 다녀왔다.,예산은 9천만 원. 코스는 ‘국립중앙박물관→잡월드→공연 관람(1시간)→롯데월드’다.,300명을 넘는 다소 많은 학생 수를 감안하더라도, 들인 비용을 생각하면 부실하다는 느낌을 떨쳐낼 수 없다. 금액 문제만이 아니다. 참여한 학생들은 ‘수학’이 아닌 ‘관광’으로 일정을 보냈다.,명분과 실질, 둘 모두 챙기지 못한 그저 값비싼 ‘서울 나들이’로 보여 안타깝다.,같은 시기 수학여행 길에 오른 Y학교의 사례를 보자.,참가자 수, 제주를 행선지로 삼은 것은 여느 학교와 크게 다르지 않다. (▶1209호 2면 참고) 그런데, 이 학교만의 남다른 점이 있다. 단체 관광· 집단 활동이 아니라, ‘헤쳐모여’ 방식으로 일정을 구성한 것이다. 학교는 ‘자연예술·역사 문화·힐링테마’로 주제를 나눈 뒤, 이에 맞춘 세부 계획을 짰다. 이에 학생들은 관심사에 따라 다양한 경험을 할 수 있었고, 인원 분산으로 교사의 인솔도 수월해졌다.,I학교의 사례도 매우 흥미롭다.,학생 수, 예산, 여행 일수까지 평균치와 놀랍도록 비슷한 이 학교는 서울·경기지역을 주요 행선지로 잡았다. ‘놀이동산’에서 하루를 보내는 것마저 다른 학교와 똑같다. 그러나 결정적인 차이가 있다.,모든 일정이 자유 투어 형식이다. 정확히는 조별 활동에 기초한 자유 투어. 이과정에서 수학여행의 알맹이를 채우는 것은 학생들의 몫이다. 자립심을 기르고 세상을 보는 시야를 넓히려면 일반 학교와 I학교, 어느 쪽 방법이 더 적합할까.,Y와 I, 두 학교의 수학여행을 비교해 보자. 각각 1인당 비용, 다양한 체험, 학생들의 자율성 보장 등 자기만의 강점이 있다는 사실을 알 수 있다.,수학여행 부실을 만들어내는 또 다른 원인은 ‘명소 탐방’이다. 특정 지역에 가면 반드시 그곳의 ‘랜드마크’를 둘러보고 와야 한다는 생각이다. 거의 강박 관념 수준이다. 여행 기회가 흔치 않던 시절에 이는 ‘인증’ 차원에서 필수 요소로 자리매김했다.,그런데 많은 수학여행이 이 ‘명소 탐방’을 의미없이 여전히 반복하고 있다. 이러한 관행을 끊지 못하는 것은 ‘여행사’에게 모든 일정을 맡기기 때문이다. 여행사가 아니더라도 가족 여행이 대중화된 지금, 수학여행에서 ‘명소 순례’를 되풀이할 필요가 있을까? 수학(修學)의 원래 목적에 맞는 일정을 마련하는 것이 더욱 교육적이고, 학생들에게 다양하고 특별한 체험을 보장할 수 있다고 본다.,깃발 따라 단체로 이동하며, 정해진 경로만 쫓아가기에 급급한 구식 수학여행, 이제는 바꿀 때가 됐다.,더욱 좋은 수학여행을 만들기 위해 중요한 역할을 맡아줄 사람이 있다. 학부모다.,일선 학교의 수학여행 비용은 지방 정부 지원과 가정 부담으로 마련한다. 지자체는 지역별 교육 여건과 환경을 고려하여 수학여행 지원금을 지급한다.,경기도교육청 소속 K교사(29)는 “지원금 규모는 지역별로 천차만별이다. 다만, 교육 환경이 열악한 지역일수록 본인 부담금이 적고, 수학여행에 대한 관심도 떨어지는 측면이 있다”고 말했다.,그는 “여행비가 세금 지원과 본인 부담금으로 구성되는 만큼, 학부모가 관심을 두고 목소리를 내면 학교에서 관행적으로 진행하는 여행 계획을 어느 정도 바꿀 수 있다”고 덧붙였다.,내실 있는 수학여행을 위해 학부모의 관심과 개선 의지가 필요한 시점이다.,",,"https://cdn.econoi.com/news/photo/202306/40245_20363_5034.png,https://cdn.econoi.com/news/photo/202306/40245_20364_5126.jpg"
나무 심고 ‘사과한’ 이유는?,광고 속으로,,2023.06.28 13:51,https://cdn.econoi.com/news/photo/202306/40243_20360_41.jpg,"유한킴벌리는 1970년, 우리나라의 제약기업인 유한양행이 미국의 킴벌리-클라크라는 개인용품 제조 기업과 손을 잡고 설립한 합작회사입니다. 대한민국 최초로 미용 티슈·일회용 생리대·화장실 전용 화장지를 출시한 곳이며, 지금도 화장지부터 마스크에 이르는 다양한 개인 위생용품을 생산하고 있습니다.,■ 유한킴벌리는 위생 관련 상품을 주로 다뤄요. 이 때문에 생겨난 고민거리가 있습니다. ‘깨끗하고 건강에 좋은 기업’이라는 이미지를 유지해야 한다는 점이에요. 주력 상품이 소비자의 건강과 곧바로 연결되기 때문에 기업의 이미지가 상품의 이미지에 매우 큰 영향을 주고, 매출을 좌우하게 된 거예요.,■ 생각할 거리는 하나 더 있어요. 이 기업의 많은 상품이 종이를 재료로 사용한다는 점입니다. 자칫하면 ‘나무를 많이 벤다=친환경적이지 않은 기업’이라는 나쁜 인상을 심어줄 위험성이 있죠.,■ 단순히 상품을 좋게 만들고, 판매하는 것만으로는 대처할 수 없는 고민거리. 유한킴벌리는 마케팅을 통해 이 문제에 대처하기로 했어요.,■ 1984년, 유한킴벌리는 ‘우리강산 푸르게 푸르게’ 캠페인을 시작했어요. 기업이 주도해서 국공유림에 나무를 심고 가꾸는 활동이죠. 처음에는 산사태와 홍수를 줄이는 것이 목표였지만, 지금은 생물다양성 보전과 탄소 중립 달성, 황사 줄이기 등 여러 목적으로 진행되고 있습니다.,■ 나무 심기는 이후 수십 년 동안 꾸준하게 이어지면서 유한킴벌리를 대표하는 유서 깊은 캠페인이 되었습니다. 무려 5,500만 그루 넘는 나무를 심고 가꾸었으며, 올해로 39주년을 맞이했죠.,■ 기업은 광고를 통해 제품과 서비스를 알리고, 기업의 이미지를 만듭니다. 소비자에게 알려지지 않으면 아무리 멋진 상품을 만들고 기업이 좋은 곳이어도 큰 성과를 거두기 어렵죠. 그래서 유한킴벌리는 또다시 고민을 시작했어요.,■ 어떻게 하면 소비자의 시선을 붙잡을 수 있을까요? 어떻게 해야 소비자가 ‘우리강산 푸르게 푸르게’ 캠페인에 흥미를 보이고, “이 기업은 친환경 적이고 좋은 기업이야”라고 생각하게 만들 수 있을까요.,■ 여러분이 오늘 살펴볼 광고가 바로 ‘유한킴벌리의 해결책’입니다.,■ 2023년 6월, 캠페인 39주년을 맞이해 유한킴벌리가 내놓은 것은 ‘축하문’이 아니었어요. ‘반성문’이었죠. 홈페이지, 유튜브, 지하철역 등 사람들의 시선이 닿는 곳곳에 이 ‘반성문’이 실렸습니다. 대체 무슨 광고인지, 풀어서 살펴보아요.,,검은색 배경은 인쇄광고에 자주 사용하는 색이 아니에요. 빛을 흡수하는 무거운 느낌의 색이라 긍정적인 메시지와 잘 맞지 않기 때문이죠. 그렇지만 이 광고는 사과문이니, 오히려 잘 어울린다고 할 수 있어요.,,‘39주년 반성문’ 말 그대로 큼지막하게 박힌 ‘39주년 반성문’이라는 핵심 문장. 소비자의 호기심을 자극하는 한편, 자연스럽게 이 캠페인이 39주년을 맞이한 활동이라는 정보를 전달합니다. ‘꾸준함, 노력, 성실함’은 얻기 어려운 이미지니, 기회를 놓치지 않겠다는 거죠.,,유한킴벌리반성문의 자세한 내용은 제각각이지만, 구성은 모두 같습니다. ‘우리가 좋은 일을 해왔지만, 그래도 아직 부족한 점이 있기에 반성합니다. 앞으로 더욱 잘할게요’. 읽는 사람을 놀라게 하는 ‘반전’을 담은 거예요. 메인 카피를 통해 자극한 소비자(광고를 보는 사람)의 호기심을 유지하는 한편, 슬쩍 기업의 활동 성과를 전달하는 역할을 합니다.,,반성문 시리즈는 총 여섯 가지 버전이 있어요. 각각 ‘지구에겐 더 많은 숲이 필요해요’, ‘멸종 위기에 처한 생물을 위해 노력할게요’, ‘산불의 후유증을 알리고 예방에 노력할게요’, ‘나무 심기만 아니라 숲 가꾸기에도 힘쓸게요’, ‘미래 2030 세대와의 소통에 노력할게요’, ‘학교만 아니라 도심 공원 등 우리 주변에도 숲을 만들게요’라는 내용을 담았습니다.,소비자는 지속가능성·숲 가꾸기·멸종위기종 지키기 등 광고에 담긴 주제에 공감과 흥미를 보이게 되고, 다양한 종류와 표현에 재미를 느낄 수 있어요. 이렇게 정보를 주고받는 과정에서 ‘재미있고, 친환경적이고, 좋은 기업이다’라는 이미지가 자연스럽게 만들어집니다.,■ 유한킴벌리 ‘39주년 사과문’ 시리즈를 한 줄로 요약하면 다음과 같아요.",,
