title,sub_title,writer,published_date,thumbnail_img,content,html_content,imgs
"어린이가 보는 세상, 어린이가 던지는 충고",“국회가 소싸움장은 아니잖아요?”,,2023.05.19 13:03,https://cdn.econoi.com/news/photo/202305/40075_20096_752.jpg,"어린이들은 우리 사회를 어떻게 보고 있을까?,5월 5일 어린이날을 맞이해, 어린이 경제신문 어니스트(기자단)와 금교잇 특파원등 ‘세상에 관심 많은’ 어린이들에게 ‘하고 싶은 말’을 들어보았다.,정치인, 기업인, 교육인 그리고 부모님께 이들이 던지는 ‘작지만 묵직한 충고’에 귀기울여 보자. 잘 듣고 적절한 답을 찾아줘야 하는 것이 어른의 책임이다.,,정치인을 향한 목소리는 쓴소리가 많다. 나랏일을 할 때 가장 중요한 것은 기본 중의 기본인 ‘상대방에 대한 존중’과 ‘질서’를 갖춰야 한다는 것. 이 두 가지가 부족한 정치인은 볼썽사나운 모습을 넘어 국민으로부터 존중 받기 힘들다는 의견을 냈다.,■ “법이 있어도 강자만 살아남는 세상 같아요. 이런 사회 분위기에서 어린 이는 의견 하나 제대로 못 내면서 어른들 의견이 무조건 맞다고 생각하며 살아갈 수밖에 없어요. 어린이도 자기 목소리를 내는 세상이 오면 좋겠어요.” (노다인·남양주 양지초),■ “정치인은 우리 사회와 미래를 더욱 발전시키기 위해 노력하고, 민족과 국가에 더 관심을 가져야 합니다. 불만과 싸움, 차별 없는 세상을 만들어 주세요.” (김서연·덕동초),■ “국회가 소싸움장이 아닌데, 왜 그렇게 싸우기만 하나요? 초등학교 학급 회의보다 국회가 더 난장판인 것 같아요. 서로를 생각하고 배려하는 자세부터 갖추는 게 맞아요.” (김건·서울 당곡초),“맞아요. 국회는 공공장소인데 왜 그렇게 질서가 없나요. 그리고 정치를 하면 국민의 의견을 들어야 해요. 말을 듣지도 않고, 국민 생각도 하지 않는 것같아요.” (권예하/박소윤·온샘초),,여러 의견에서 가장 많이 지적한 내용은 환경을 생각하는 기업, 안심하고 사용할 수 있는 상품을 만들어달라는 것. 기업 경영의 화두로 떠오른 ESG(환 경·사회적 책임·정도 경영)와 통하는 내용이다.,■ “기업은 친환경적인 제품을 많이 만들어 주세요. 우리의 미래가 쓰레기로 뒤덮이지 않게, 깨끗하게 만드는 것은 기업의 책임이 크다는 생각이에요.” (김재인·반송초),■ “어린이가 안심하고 먹을 수 있는 식품, 문제없이 바를 수 있는 화장품, 유해 물질 없는 상품을 만들어 주세요. 성분표를 일일이 보지 않아도 안심하고 믿고 사용할 수 있는, 그런 상품이 필요해요.” (윤나영·성남 중앙초),,인공지능(AI)의 시대를 맞아, 어린이는 이전 어느 세대보다 ‘스마트’해졌다. 이제는 교육과 학습을 넘어 진로를 배우고 싶다는 목소리가 크다.,■ “진로 관련 프로그램을 늘려주세요. 저는 다행히 좋아하는 쪽으로 진로를 찾았지만, 친구들을 보면 진로 때문에 고민하는 모습이 많이 보여요. 공부도 그냥 잘하는 것보다 진로에 맞게 할 때 더욱 경쟁력이 생긴다고 생각해요.” (조유나·신안중),■ “교과서에서 사회과목이 너무 어려워요. 초등학교 교과서에 맞춰 쉽게 해 주면 좋겠어요. 같은 학년이라도 여러 단계로 나눠 수준별 학습을 할 수 있으면 얼마나 좋을까요.” (심보민·서울 공덕초),,5월은 가정의 달이다. 어린이날, 어버이날 등 가족이 정을 나누고 서로를 생각하는 기회가 많다. 어린이들이 부모님께 드리고 싶은 말씀을 물어보니, 애교 어린 항의가 많다. 물론, 부모님도 할 말이 많을 것이다.,이번 기회에 서로 속마음을 터놓고 이야기하는 시간을 가져보면 어떨까? 틀림없이 가족이 한층 더 가까워지고, 마음을 나누는 좋은 기회가 될 것이다.,■ “지금도 다니는 학원이 많아서 힘들어요. 가야 할 학원 수를 더 이상 늘리지 말아 주세요.” (이선우·대구 대실초),■ “할머니에게 받은 용돈, 제게 주신다면서 왜 한 학기씩 미루고 있나요. 제돈제관(제 돈 제가 관리)하게 해주세요.” (김세린·용황초),■ “휴대전화도 사용하지 말라고 하면서, 왜 엄마는 취침 전까지 휴대폰 쓰고 드라마도 보시나요?,■ 저녁 식사할 때 술을 자주 드시는데, 저는 왜 음료수도못 마시게 하시는지….”,(이소율·옥길버들초 / 최서은·철산초 / 박소윤·온샘초),소소하지만, 어린이 눈높이에서 보면 공감 가는 내용으로 보인다.,부모님들은 자녀들에게 하고 싶은 말이 없을까?,마침 미국 ‘어머니의 날’을 맞아 부모의 마음을 잘 담은 짧은 문장이 있어 소개한다.,십 대 자녀를 키우는 부모들을 위한 ‘Your teen’이라는 해외 웹사이트가 있다. 이 사이트에서 큰 인기를 끈 ‘To My Teenage Son: What I Want For Mother’s Day From You(나의 십 대 아들에게: 어머니의 날을 맞아 너에게 바라는 것)’라는 글이다.,“What I want for Mother’s day from you are that you will always want to tell me about who you eat lunch with at school.”",,
총성 없는 경제 전쟁 방곡령과 ‘식량 주권’,반사경,,2023.05.22 11:46,https://cdn.econoi.com/news/photo/202305/40075_20096_752.jpg,",1889년, 당시 함경도 관찰사(오늘날 도지사) 조병식(1823~1907)은 ‘방곡령’을 선포합니다. ‘곡물을 방어하는 명령’이라는 뜻으로, 곡물의 유출을 엄격히 금지하는 내용이에요. 전년도부터 이어진 흉작에 굶주리는 사람이 갈수록 늘어나자 내린 결정이었죠. 이 명령으로 함경도의 콩은 단 한 쪽도 외부로 나갈 수 없게 됐어요.,일본은 크게 반발했어요. 조선 정부에 함경도의 방곡령을 항의하는 동시에, ‘방곡령 선포는 한 달 전에 미리 통지한다’는 기존 약속을 어긴 것도 문제 삼았어요.,소식을 들은 조선 정부는 사태 수습을 위해 일단 ‘방곡령 해제’ 명령을 내렸어요. 그러나 조병식은 꼼짝도 하지 않았어요. 더 나아가 일본인이 사들인 곡물까지 압수하고 나섰죠.,상황이 진정되지 않자, 정부는 조병식을 강원도 관찰사로 보내면서 함경도 방곡령을 해제했어요. 하지만 새로 부임한 함경도 관찰사도 다시 방곡령을 선포했어요. 이 무렵 이웃한 황해도에서도 방곡령이 선포됐지요. 그때마다 일본의 반복되는 항의에 얼마 못 가 방곡령은 해제되고는 했지만, 이런 상황은 1894년까지 5년 동안 반복됐어요.,조선의 방곡령은 실패로 끝났지만, 먹거리와 관련된 ‘식량 주권’이 얼마나 중요한지 보여주는 역사적 사건입니다. 이와 닮은 최근 두가지 경제 상황도 함께 살펴봅시다.,19세기도 아닌 21세기에 ‘방곡령’이 내려졌어요. 1년 전인 2022년 5월의 일입니다. 나렌드라 모디 인도 총리가 ‘식량 안보’를 주장하며 전격적으로 밀수출 금지령을 내렸어요. 금지령을 내린 이유는 크게 두 가지.,과 인도 내부의,때문이에요. 러시아의 흑해(黑海) 봉쇄로 우크라이나 밀수출이 막히자 여러 나라가 앞다퉈 인도 밀을 찾기 시작했고, 인도 총리는 국내의 밀 부족 현상이 나타날 것을 우려해이 같은 조치를 취했어요. 이상 기후도 밀 수확 감소에 한몫 했어요. 흉년으로 인도 사람 먹을 것도 부족할 수 있는 상황에, 무턱대고 밀을 수출하기란 어려운 일이었겠죠.,인도의 밀 수출 금지에 지난해 세계 곡물 가격은 요동쳤어요. 세계 2위 밀 생산국인 인도가 빗장을 닫아 걸었으니 당연한 결과입니다.,원치 않게 ‘방곡령’을 겪는 나라도 있어요. 앞서 본 우크라이나입니다.,우크라이나는 유럽의 대표적인 농업 생산국입니다. 그러나 1년 넘게 이어지는 러시아의 침공으로 인해 흑해 바다로 통하는 곡물 수출길이 막혀버린 상황이에요. 자신의 뜻과 관계없이 러시아로부터 강제로 ‘방곡령’을 당한 셈이에요. 다행스럽게도 지난해 7월 UN(국제연합)과 튀르키예의 중재로,이 체결됐어요.,하되,,는 것이 이 협정의 주요 내용입니다. 눈앞에 다가온 5월 18일(목)은 협정의 만료일이에요. 두 나라의 전쟁이 격화하면서 지금까지 두 차례에 걸쳐 연장된 곡물 협정이 ‘이번에는 쉽지 않다’는 관측이 나오고 있어요. 국제 곡물 시장이 다시 한 번 고비를 마주한 상황입니다.",,
이천 여성새로일하기센터 가정의 달 축제,'원시 경제에서 창업까지' 온 가족 경제 캠프,,2023.05.19 17:24,https://cdn.econoi.com/news/photo/202305/40075_20096_752.jpg,",,,,,,,온천 공원에서 경제에 관한 체험을 했다.,처음엔 원시시대를 배경으로 금, 조개껍데기, 유리구슬, 광물 등을 원시 화폐로 사용했다. 원시 시대에서 가치 있게 여겨지는 것을 생각해 보고, 물물교환을 통해 필요한 것을 얻기도 했다. 이 과정을 통해 원시시대의 경제생활이 어땠을까 상상 해볼 수 있어서 좋았다.,이웃과 합쳐 나라를 만들었다. 나라 이름을 만들고, 국기를 그리고, 대통령·총리·경제부 장관 등 역할도 정했다. 나라를 만든 뒤 이어진 축제. 자신 있는 종목으로 물품화폐를 얻었다. 물품은 금, 광물, 조개껍데기와 유리구슬.,물품 화폐를 가져올 때 엄마와 나는 가장 비쌀 줄 알고 금을 많이 확보했다. 그런데 다른 사람들도 그렇게 생각했고, 결국 가장 많이 선택한 금의 가치가 가장 낮은 결과로 이어졌다.,4개 물품에서 가장 높은 가치를 갖게 된 것은 조개껍데기. 시장에 풀린 수량에 따라 가치가 달라질 수 있다는 게 생소하면서도 재미있었다.,이 과정을 거쳐 드디어 화폐가 탄생했다. 이 돈으로 점심 도시락 가격을 지불하고, 세금을 내는 과정을 놀이로 배워 재미있었다. 세금을 이용해 어떤 상품을 만들어 팔 것인지 고민하면서 입찰로 재료를 확보하는 등 경제를 생생하게 체험했다.,물건을 만들어 사업가 입장에서 홍보하고, 팔릴 때마다 성취감을 느껴서 좋았다. 활동 내내 수입 지출 기록장을 쓰면서 용돈 기입장의 중요성을 배웠다. 이날 가장 크게 얻은 것은 우리를 위해 열심히 일하시는 부모님 노력을 조금이나마 알게 됐다는 점이다. 정말 좋은 경험이었다.",,"https://cdn.econoi.com/news/photo/202305/40143_20176_1618.jpg,https://cdn.econoi.com/news/photo/202305/40143_20172_915.jpg,https://cdn.econoi.com/news/photo/202305/40143_20173_939.jpg,https://cdn.econoi.com/news/photo/202305/40143_20177_1710.jpg,https://cdn.econoi.com/news/photo/202305/40143_20174_1022.jpg,https://cdn.econoi.com/news/photo/202305/40143_20175_1137.jpg"
‘2023년 어경이 강사의 날’ 개최,"창립 22주년, 대규모 교육 앞두고",,2023.05.26 11:00,https://cdn.econoi.com/news/photo/202305/40075_20096_752.jpg,"‘2023 어경이 강사의 날’을 맞이해, 지난 21일(일) 서울 마포중앙도서관에 ㈜이코노아 이 강사 31명이 자리를 같이했다.,이날 행사는 본사 창립 22주년(6월 22일)과 2023 어린이 로스쿨 등 대규모 교육을 앞두고 열렸다. 본사는 10년 이상 함께 활동한 강사와 도서 출간, 지역별 교육 진행 등에서 공로가 있는 12명의 강사에게 공로상을 전달했다.,권국향 강사는 NIE(신문 활용 교육)의 가치에 대한 미니 특강을 진행했고, 본사 박원배 대표는 회사 창립에 맞춰 6월 중 쇼핑몰 오픈을 시작으로 사회적 협동조합 설립, ‘꼭! 이지 NIE’와 ‘놀이와 체험형 프로그램’을 기반으로 한 전국 프랜차이즈 구축, <어린이 경제신문>을 활용한 도서 시리즈 출판 등 강사들과 함께할 수 있는 사업 계획을 발표했다. 이에 대해 참석자들은 조합 설립, 지역 교육센터 운영 등 다양한 분야에서 협업하겠다는 뜻을 밝혔다.,한편 이들 강사는 본사에서 진행하는 ‘경제 금융교육 지도사 과정’과 ‘경제 금융교육 NIE 과정’ 등 36시간의 강사 교육을 마친 뒤 온오프라인을 통해 경제, 금융, 법 등 다양한 교육 활동을 담당하고 있다. 본사는 올해도 경제교육지도사, 진로·직업 체험지도사, 유아 경제 교육지도사 등 다양한 분야에서 강사 양성 과정을 운영한다.",,"https://cdn.econoi.com/news/photo/202305/40172_20234_587.jpg,https://cdn.econoi.com/news/photo/202305/40172_20235_5852.jpg"
자녀에게 사주면 좋은 주식 ⑧ 시장·산업·국가 ETF 등 종류 ‘많아’,릴레이 샘 경제,,2023.05.31 11:52,https://cdn.econoi.com/news/photo/202305/40075_20096_752.jpg,"지난 시간에는 ETF가 무엇인지 알아봤어요.,오늘은 어떤 ETF가 있는지, 투자할 ETF를 어떻게 고르는지 쉽게 알아봅니다.,증권 시장, 증시와 같은 단어는 많이 들어봤을 거예요. 기업이 증권거래소에 주식을 등록하고, 일반 투자자도 주식을 살 기회를 만드는 것을 ‘주식 시장에 상장(上場)한다’고 해요. 우리나라의 대표적인 주식 시장으로는 코스피와 코스닥이 있습니다. 미국을 대표하는 주식 시장은 뉴욕 증시와 나스닥이 있죠.,ETF도 이름을 잘 보면 성격을 이해할 수 있어요. 우리나라의 대표 ETF 중 하나인,은 코스피에 상장해 있는 상위 200개 기업에 분산투자하는 ETF 상품입니다. 상위 200개 기업이면 코스피 시장 전체에 투자한다고 볼 수 있어요.,,은 코스닥에 상장한 상위 150개 기업에 투자하는 ETF입니다.,이 역시 시장 전체에 투자하는 ETF로 분류되죠. 미국 증권 시장 전체를 대상으로한 ETF로는 SPY, QQQ, IVV가 대표적입니다.,에너지, 필수 소비재, 반도체, 배터리 등 다양한 회사를 산업별로 묶어서 판매하는 것을 산업 ETF라고 합니다. TIGER 2차 전지 테마, KODEX 반도체, KODEX 은행과 같은 ETF는 이름 그대로,입니다.,인도에 관한 뉴스를 본 적 있나요? 최근 인도의 경제 성장세가 놀랍습니다.,인구는 이미 중국을 따라잡았고, 젊은 층이 많아서 꾸준한 성장세가 예상돼요.,한편, 중국에 투자했던 글로벌 기업들이 무역 전쟁의 영향으로 시작된 중국 정부의 제재를 피해 옮겨가면서 베트남이 호황을 누리고 있죠.,이러한 소식을 들어도 개인 투자자는 다른 나라의 기업을 잘 알지 못해요.,인도나 베트남의 대표적인 기업을 알기도 어렵고, 투자에 나서기도 힘들죠.,이때 활용하는 게 바로,입니다. 자산운용사(펀드 상품을 만들고 운용하는 회사. 판매는 증권사, 은행 등 주로 유통망이 있는 곳에서 대행해요)에서 ETF 상품으로 만든 인도 ETF, 베트남 ETF에 투자하는 것입니다.,앞서 자녀에게 사주면 좋은 주식에서 배당주, 기술주, 우량주를 설명했어요.,그렇지만 실제로 관련 주식을 찾고, 골라서 투자하기란 개인 투자자에겐 힘들고 어려운 일이죠. 이럴 때에도 ETF를 활용할 수 있어요. 고배당주 ETF처럼 높은 배당률을 자랑하는 회사를 모은 상품이 있고, 가치주 ETF도 있죠.,ETF의 종류는 아주 다양합니다. 같은 회사라도 자산운용사가 출시하는 상품에 따라 다른 ETF로 묶여서 탄생할 수 있어요. ETF 투자에 관심이 생겼다면, 이번 기회를 통해 내가 선호하는 ETF 분야를 찾고 투자를 결정해 보세요.,※ 이 글은 특정 종목에 대한 추천이나 상품 구매를 유도하기 위한 것이 아닙니다.,부모님이 주식으로 자녀 경제교육을 하는 데 도움을 드리기 위한 것임을 알려 드립니다.,이상진 어니스트(한빛초 교사)",,https://cdn.econoi.com/news/photo/202305/40185_20261_5012.jpg
헌 부대에 새 술! ‘뉴-트로 전성시대’,길거리 경제,,2023.05.31 11:35,https://cdn.econoi.com/news/photo/202305/40075_20096_752.jpg,"사진을 보세요. 커피를 파는 카페예요. 그런데 아무리 봐도 영화관 같아요. 가운데 자리한 출입문, 층층이 쌓인 계단과 의자까지. 곧 영화가 시작할것 같지 않나요?,결론부터 말하자면 둘 다 맞아요. 이곳 이름은 ‘경동 1960’. 서울 동대문구 경동시장에 있는 아주 오래된 극장이에요. 약 60년 전쯤 지어졌죠. 무척 낡은 데다가 찾는 사람도 없어 최근까지 버려진 상태나 마찬가지였죠.,이런 극장이 카페로 ‘환생’한 것은 지난해 12월. 영업 개시와 동시에 손님이 몰려들어 가게 안은 언제나 붐벼요. 찾는 손님도 다양해요. 시장을 찾았다가 소문을 듣고 들른 나이 지긋한 어르신들부터 ‘핫플레이스’를 골라다니는 20대까지, 남녀노소 가릴 것 없이 모두를 아우르고 있어요.,‘경동 1960’만의 얘기가 아니에요. 최근 몇 년 사이 이처럼 옛 공간에 새로운 감각을 더한 장소가 여기저기 생겨나고 있어요. 강화도 조양방직은문 닫은 공장이 카페로 재탄생한 곳입니다.,이 공장은 무려 90년이 된 건물이죠. 자칫 황량할 수 있는 느낌을 바꾸기 위해 미술관 기능을 더했어요. 그 결과 다른 데서는 느낄 수 없는 이곳만의 색다른 감성이 만들어졌죠. 아주 오래된 것과 완전히 새로운 것이 빚어낸 오묘한 분위기가 사람들을 끊임없이 끌어들이고 있어요. 이 밖에 200년 넘은 한옥을 고쳐 활용한 경상북도 문경 ‘화수헌’이나, 500년 조선왕조 역사가 담긴 경복궁 생과방도 모두 비슷한 사례로 꼽혀요.,막연히 생각하면 그다지 어울리지 않을 것 같은 게 있어요. 새로운 것과 오래된 것의 조합이에요. 그런데 그 결과는 뜻밖에도 ‘대박’으로 이어지고 있어요. 어떻게 이런 일이 가능했을까요?,첫째,,이 핵심이에요.,낡고 오래된 물건이나 공간은 잊히거나 버려지기 쉬워요. 여기에 새로운 숨결을 불어 넣어 되살린다는 생각 자체를 해내기 어렵죠. 하지만 남들이 쉽게 떠올리지 못한 바로 이 아이디어가 출발점이 됐어요.,둘째,,예요.,단순히 옛날 것만 잔뜩 모아 놓으면 결코 주목받지 못하는 흔한 박물관이 되었을 거예요. 반대로 최신형만 한가득 들여놨다면 여느 가게와 다를 게 없겠죠. 무턱대고 두 가지를 섞었다면 뒤죽박죽이 되면서 ‘정체성을 잃었다’는 비판을 피하기 어려울 거예요. 전통과 현대처럼 전혀 다른 것들을 조절하여 어우러지도록 하는 것, 어려운 말로 절충(折衷)이라고 해요.,셋째, 기존의 틀을 깨는,가 중요해요.,원래의 형식과 틀에 얽매일 필요는 없어요. 앞서 본 것처럼 극장이나 공장이 카페가 될 수도 있고, 더 이상 사용하지 않는 기차역이 미술관으로 변신할 수도 있죠. 그대로 두었다면 잊혔을 공간이 새롭게 태어난 데에는 틀에 박히지 않은 말랑말랑한 생각이 중요한 역할을 했어요.,한 가지 더! 다른 나라와 견줄 수 없을 정도로 빠르게 발전해서 ‘압축성장’의 대명사로 불리는 대한민국. 유행도 금방금방 바뀌고, 감각이나 취향도 세대마다 상당히 달라요. 당연히 한 공간에서 각자의 취향을 다 충족하고, 나이대가 다른 사람과 감각을 공유하기란 쉽지 않죠. 이 두 가지를 모두 경험할수 있는 ‘헌 부대 속 새 술’이 큰 인기를 끄는 이유가 아닐까요.,‘옛것을 본받아 새로운 것을 창조한다’는 뜻이다. 옛것을 잘 알아서 기초로 삼으며, 변화를 거듭하여 현실에 맞는 새로운 방법을 창조하라는 의미를 담고 있다.",,
"수학여행, 이제 바꾸자(상) ‘수학’은 없고 ‘관광’만 있다",길거리 경제,,2023.06.07 11:57,https://cdn.econoi.com/news/photo/202305/40075_20096_752.jpg,"지난달 말 김포공항. 몇 시간 넘게 비행기가 날아오르지 못했어요. 한두 대도 아니고, 무려 100여 대가 꼼짝없이 발이 묶였어요. 원인은 다름 아닌 ‘헤어 스프레이’.,오랜만에 수학여행에 나선 여러 학생이 무심코 짐가방에 반입금지 물품인 스프레이를 넣어 온 게 문제가 됐어요.,결국 가방을 일일이 열어 전수 검사를 해야 했고, 대기시간도 늘어나고 말았습니다.,코로나19 사태가 끝나면서 다시 활발해지는 수학여행. 그렇지만 이날의 사건은 단순한 일회성 사고가 아니라, 준비가 부족하고 변화가 필요한 대한민국 수학여행 문화를 단적으로 드러냈다면 과장일까요?,수학여행을 이제는 바꿔야 한다는 목소리가 높아지고 있어요. 구시대의 잔재인데다, ‘수학(修學, 학문을 닦음)은 없고 여행만 있다’는 비판이 주된 이유입니다.,우리나라 수학여행은 약 120년 전 처음 시작됐어요. 지금처럼 교통이 발달하지 못했던 옛날, 개인이 먼 곳으로 여행을 떠나기란 무척 어려웠어요. 학교에서 배우는 유명한 장소나 역사 유물을 볼 기회가 부족했죠. 이 틈을 메워준 것이 수학여행이에요. 평소 배운 것과 현실 속 체험을 하나로 만들자는 목표였죠.,일제강점기(1910~1945)에는 수학여행에도 일본의 입김이 유난히 강했어요.,‘식민 통치로 조선이 발전한 것을 보여주겠다’라는 왜곡된 목적으로 이름난 회사, 공장, 시설을 찾게 했죠. 수학여행은 점점 배움의 목적에서 벗어나 단순한 관광여행으로 변했어요.,,국가 및 교육기관 등에서 필요한 상품·서비스를 공개 입찰하는 온라인 사이트. 이름 그대로 장터를 상상하면 이해하기 쉬워요. 각급 기관이 필요한 것을 알리고, 경쟁을 통해 조건에 맞는 회사를 찾아 공급을 맡겨요. 회사가 여러 곳이면, 조금이라도 싸고 품질 좋은 곳을 고르겠죠?,한 세기가 넘은 역사를 보낸 오늘의 수학여행, 어떤 모습일까요?,지난 4월 1일부터 10일 사이 열흘 동안 ‘나라장터’ 에 게시된 수학여행 입찰 공고를 모두 분석했어요.,입찰 공고의 구체적인 내용을 확인할 수 있는 것은 모두 167건. 학교마다 다소 차이가 있지만, 평균 학생 수는 203명,,범위를 조금 넓혀도 비슷한 모습이에요.,이 116건으로,한 학교당 평균 예산은 1억 4백 62만 원. 결코 적지 않은 돈이에요.,그렇지만 학생들은 금액에 비해 그다지 의미 있는 일정을 보내지 못하고 있어요. 일정을 보면 대부분 시간을 관광 명소를 훑고 다니는 데 그치고 있으니까요.,‘4성급 호텔 또는 리조트. 호텔식 1식 5찬…’ 수학여행 입찰 공고에서 자주 볼 수 있는 내용이에요. 학교에서 계획을 짜면서 학생들의 숙식에 많은 관심을 기울인다는 점을 알 수 있어요.,문제는 콘텐츠. ‘알맹이’가 부족해요. 목적지와 코스가 비슷하고 천편 일률적이에요. 서울을 목적지로 수학여행을 가는 M학교의 사흘 일정을 볼까요?,을 둘러봤어요. 이 과정에 들어간 총 비용은 7천만 원. 하루는 모두 놀이동산으로 채웠죠. 여기에서 이름인 ‘수학’은 찾아보기 힘들어요. 제주로 떠난 학교도 다르지 않아요. 카페거리, 바닷가와 같은 관광 지역을 들른 뒤 ‘노형 수퍼마켙’, ‘스누피 가든’ 등 유명 전시관을 둘러보는 게 대부분이죠.,학생들의 수학여행 가방에서 헤어스프레이가 나온 것은 우연이 아니에요. 본래 취지인 배움보다 멋지게 꾸미고 신나게 노는 여행으로 초점이 옮겨가면서 생긴 일이죠. 그런 스프레이가 학생들의 귀한 시간을 빼앗았다니, 참 역설적이네요. 수학과 여행, 두 가지 모두 살릴 방법은 없을까요?,,,",,
