title,sub_title,writer,published_date,thumbnail_img,content,html_content,imgs
베트남 ‘No 블랙핑크-No 바비’ 이유는?,"선생님이 들려주는 시사 이야기,
지금 세계는?",,2023.08.08 10:05,https://cdn.econoi.com/news/photo/202307/40337_20515_2635.jpg,"블랙핑크가 베트남에선 인기가 없을까요? 아니면 블랙핑크의 노랫소리나 가사가 베트남 사람들을 불쾌하게 만들었을까요? 그건 아니에요.,사실, 이번 블랙핑크 콘서트에서 논란이 된 것은 그룹 블랙핑크가 아니에요. 콘서트를 준비하는 ‘iME 엔터테인먼트’라는 공연 기획사에 문제가 있었죠. 이 회사가 콘서트를 준비하는 도중, 홈페이지에 ‘구단선’이 표시된 지도를 올린 것이 문제였습니다. 베트남 사람들은 블랙핑크가 베트남에서 공연한다는 소식에 처음에는 기뻐했어요. 하지만 기획사의 구단선 표시 지도를 보고 화가 나 불매운동을 벌이기 시작한 거예요. 도대체 구단선이 뭔데 불매운동까지 벌이는 것일까요?,구단선은 중국이 만든 가상의 해상 경계선이에요. 실제로 있지는 않은데, ‘여기까지가 중국의 영해(중국의 바다)’라고 주장하는 선이에요. 지도로 보면 ‘U자’ 모양을 한 9개의 선이라서 ‘9단선’ 또는 ‘구단선’이라고 불러요.,중국은 구단선을 내세워 남중국해, 베트남과 필리핀의 섬이 있는 바다까지도 자신의 것이라고 주장하고 있어요. 베트남이나 필리핀 같은 동남아시아 지역 국가들은 당연히 기분이 나쁠 수밖에 없어요. 자국의 앞바다를 중국이 마음대로 자기 바다라고 주장하니까요.,중국의 이런 주장은 국제상설중재재판소(PCA)에서도 국제법상 근거가 없다고 판결했어요. 그렇지만 중국은 여전히 주장을 굽히지 않고 ‘구단선에 따라 여기까지 내 바다’라고 외치고 있어요.,이번 구단선 논란으로 곤란을 겪은 것은 블랙핑크뿐만이 아니에요.,바비 인형은 역사가 깊은 유명한 장난감 인형입니다. 얼마 전, ‘바비’를 주제로 영화도 만들어졌어요. 그렇지만 영화 ‘바비’에서 등장하는 지도에 구단선이 표시되어 있어서 문제가 생겼습니다. 베트남은 이 영화가 중국의 일방적인 영해권 주장을 반영했다는 이유로 상영을 금지했어요. 어떻게 보면, 사람들의 마음에 파고드는 문화 콘텐츠라서 더욱 예민하게 반응하는 것 같기도 합니다. 구단선이 정확하게 어디에 만들어진 경계선인지 찾아보세요. 이번 논란을 더욱 깊이, 넓은 눈으로 이해할 수 있을 거예요.,▶ 이상진 선생님이 쓴 글을 읽고, QR코드로 메타버스에 접속해서 퀴즈를 풀어보자.,이상진 어니스트(한빛초 교사)",,https://cdn.econoi.com/news/photo/202308/40360_20565_583.png
"미래 위한 선택, 제로웨이스트",도담도담 샘의 친환경 이야기,,2023.08.02 15:17,https://cdn.econoi.com/news/photo/202307/40337_20515_2635.jpg,"제로웨이스트는 ‘Zero’와 ‘Waste’가 합쳐진 단어입니다. 말 그대로 ‘쓰레기가 없는’ 것을 뜻해요.,모든 제품, 포장과 자재를 태우지 않고 다시 사용할 수 있도록 하는 것을 목표로 하는 활동이죠. 이렇게 하려면 쓰레기를 매립지나 소각장으로 보내는 것을 줄이고, 재활용, 퇴비, 재사용을 해야 합니다.,제로웨이스트를 달성하면 쓰레기 처리 비용을 줄일 수 있고, 재활용과 퇴비화로 새로운 원자재 사용을 줄여서 자원을 절약할 수 있습니다. 환경보호만 아니라, 경제적으로도 이익을 얻을 가능성이 있는 개념이라고 할 수 있어요.,비 존슨은 ‘쓰레기 제로 운동’을 펼치는 세계적 환경 운동가입니다. 그녀는 전 세계 사람들에게 ‘5R 운동’에 나서자고 요청하고 있어요. 5R 운동이 무엇인지 살펴볼까요?,배달 앱이나 매장에서 음식을 주문할 때 ‘일회용 수저, 포크 안 주셔도 돼요’ 또는 ‘영수증 드릴까요?’ 라는 선택 사항을 찾아볼 수 있어요. 굳이 필요하지 않다면 일회용품을 거절해 보세요.,음식물 쓰레기는 재활용이 어려워서, 따로 모아서 퇴비화해야 해요. 도시에서는 쉽지 않은 일이니, 음식물을 최대한 남기지 않으려고 노력해 주세요.,재활용할 수 있는 쓰레기는 꼭 재활용해요. 올바른 분리배출을 통해 쓰레기 배출량을 줄여 주세요.,플라스틱 빨대를 거절해요. 그 대신 다시 사용할 수 있는 스테인리스 빨대를 사용하고, 일회용 컵이나 용기 대신에 재사용할 수있는 텀블러를 가지고 다녀요.,상품을 구입할 때는 나에게 필요한 것인지 다시 한번 확인하고 구매해요. 꼭 필요한 것만 구매해요.,고은미 어니스트(경제금융교육지도사, 환경교육 칼럼니스트, 어린이 경제신문 논술 강사)",,https://cdn.econoi.com/news/photo/202308/40351_20549_1456.jpg
'어린이 경제신문 창간 22주년 공모전' 수상작 발표,,,2023.08.02 16:02,https://cdn.econoi.com/news/photo/202307/40337_20515_2635.jpg,"지난 7월 28일(금). 약 1개월에 걸쳐 진행된 <어린이 경제신문 창간 22주년 기념 신문 활용 공모전>의 최종 수상자가 결정됐다.,어린이부에서는 유현준 어린이(대상)를 비롯한 18명이, 학부모부에서는 오승희 님(대상)을 비롯해 모두 8명이 수상의 영예를 차지했다.,이번 공모전에서는 자유로운 구성을 위해 형식 제한을 가볍게 했다. 그 결과 어린이부에서는 시, 만화, 산문, PPT와 짧은 영상까지 다양한 방식의 작품이 제출돼 어린이들의 높은 창의력을 드러냈다.,학부모부 작품은 <어린이 경제신문>을 활용한 경험담으로써 공유 가치가 높은 것으로 평가됐다. 대상 수상자의 경험담 중 일부를 요약해 소개한다.,수상자 작품의 내용 전문은 앞으로 어린이 경제신문 홈페이지 (www.econoi.com)를 통해 공개할 예정이다.,#1. 설날이나 추석 같은 명절만 지나면 아이들의 지갑은 나보다 더 두둑해진다. 지갑만 두둑해지는 게 아니다. 배짱까지 두둑 해지는 것 같다. 돈이 생기는 꼴을 못 본다.,바로 써야만 직성이 풀리나 보다. 대체 누굴 닮아 저러는 거야? ‘아뿔싸!’ 1993년 아홉 살의 나와 2023년 열 살이 된 아들의 모습이 겹쳐진다. 그래, 피는 못 속이는구나.,나 같은 수능 세대에서는 공부만 잘해도 잘 먹고 잘 살 수 있었다. 하지만 우리 아이들이 앞으로 살아가야 하는 시대에서는 돈의 가치와 경제 개념 없이는 총알 없는 전쟁터에 뛰어드는 것과 마찬가지라고 생각한다. 이래서는 안 되겠다 싶어서 중요한 선택을 했다.,<어린이 경제신문> 구독신청을 한 것이다.(중략),#2. 신문이 도착하는 날이면 일단 기사 전체의 큰 제목만 읽게 했다. 그러다 보면 본인이 관심 있거나 흥미가 느껴지는 부분에서 잠깐 멈춰서 읽기도 했다.,그리고 주 2회 정도는 아이의 수준과 관심 정도, 적시성 있는 기념일, 사회적 이슈 등을 고려하여 신문 내용을 활용할 수 있는 기사를 미리 선정해 두었다.,해당 내용을 읽고 활용하는 방법에 제한을 두지는 않았다. 지금은 속도보다는 방향이 중요했다. 올해 내 목표는 아이가 신문이라는 매체와 친해지게 하는 것이기 때문이다. (중략),#3. 흔히 신문의 중요성을 알고 구독 신청을 하는 것을 주변에서도 보긴 했다. 하지만 아이에게만 일방적으로 읽으라고 강요하고 그에 대한 결과물을 바라는 것은 순전히 부모의 욕심이라 생각한다.,함께 동행하며 공유하고 풀어나가면서 그 길을 안내해 주고, 가는 도중에 비바람이 몰아쳐서 물웅덩이에 빠지고, 돌고 돌아 먼 길로 가더라도 곁에서 응원하고 함께 목적지를 찾아가는 것이 부모의 역할이라 생각한다.,1년 뒤 혹은 그 이후, <어린이 경제신문>과 함께 달라져 있을 아이의 모습이 벌써부터 기대되고 설렌다.,글·사진 오승희",,https://cdn.econoi.com/news/photo/202308/40357_20560_5340.jpg
협동·협력·협업··· 함께 만든 세상 ‘나는 글로벌 리더’,,,2023.08.09 13:39,https://cdn.econoi.com/news/photo/202307/40337_20515_2635.jpg,"7월 26일 수요일. 서울 마포중앙도서관 세미나실에서 경제 캠프 ‘나는 글로벌 리더’ 가 진행됐다. 이날 서울의 낮 최고기온은 32도. 소나기까지 내리는 찜통더위였지만, 행사장의 열기는 그보다도 더 뜨거웠다. 참가한 30여 명의 어린이 글로벌 리더들은 4개 나라를 건국했다. 이날 탄생한 나라(마이크로네이션)은 카푸코넛공화국, 디저트탑, 다라국, 독일레시아다.,생산 게임으로 자원을 확보하고 무역에 나선 참가자들. ‘글로벌 리더’라는 명칭에 걸맞게 이들의 세계인 ‘어경월드’를 바삐 누볐다. 국가와 국가 사이에는 상품이 오가고, 무역수지를 조금이라도 더 높이기 위한 전략회의도 이어졌다. 자국 상품을 알리기 위한 발표회도 필수 요소. 챗GPT 까지 동원한 ‘나라 스토리 만들기’와, 고사리손으로 정성껏 그린 홍보물이 내걸렸다.,나라별 환경과 특산물이 서로 다르다는 게 이날 캠프의 포인트.,자동차 기술 강국이지만 미세먼지에 시달리는 ‘독일레시아’, 산유국이지만 정치적 불안에 놓였다는 설정의 ‘카푸코넛공화국’처럼 각국의 처지는 크게 달랐다. 이웃 나라의 수요를 짚어내고, 자기 나라의 강점을 살려야 무역 경쟁의 승자가 된다. 말 그대로 온몸으로 부딪히며 글로벌 리더십을 터득했다.,경쟁 못지않게 중요한 경제의 핵심, 바로 협동이다.,세계를 무대로 뛰는 이들에게 ‘나 홀로’는 고립과 동의어. 외부의 경쟁이 치열해질수록, 내부의 단결은 더 굳건해졌다. 한 사람 한 사람 이 역할을 맡고, 협력해서 매끄럽게 굴러가야 진정한 성공을 거둘 수 있다. 캠프에 함께한 어린이·학부모들은 어떤 생각을 하고 있었을까?,이들의 목소리도 들어 보자.,● <어린이 경제신문> 구독자인 오빠와 함께 신문을 읽으면서 경제에 관심이 생겼어요. 생산 게임을 통해 직접 경험하고, 친구들과 협동하면서 무역을 하면서 더 많이 배우게 됐어요.  / 유연재 (4학년),● 아버지가 평소 경제에 관한 이야기를 자주 해주세요. 얼마 전부터 포스코 홀딩스에 주식투자도 시작했는데, 그러다 보니 더 관심이 가요. 다 같이 나라 알림 포스터 만든 게 재밌었어요. / 윤찬호 (6학년),● 설명만으로 경제를 가르치면 아이들은 어렵게 생각하죠. 체험 형태로 경제 요소를 직관적으로 이해시키고, 눈높이에 맞춘 활동이 많아 인상적입니다. 이런 체험을 알고 더 많은 아이들이 참여했으면 좋겠어요.  / 유은석 (학부모),",,https://cdn.econoi.com/news/photo/202308/40361_20566_944.png
"우리나라 첫 보험, 석 달 만에 사라지다",반사경,,2023.08.09 16:02,https://cdn.econoi.com/news/photo/202307/40337_20515_2635.jpg,"1897년 6월, 우리나라 최초의 보험 상품이 등장했어요. 그런데 가입 대상이 조금 특이했어요. 사람이 아닌 동물이 대상이었죠. 바로 ‘소’. 대조선보험 회사가 내놓은 이 상품의 보험료는 소 한 마리에 매년 1냥(兩, 현재 기준 약 5만 원)이었어요. 소한테 직접 돈을 받을 수는 없으니, 주인이 대신 지불했죠. 꼬박꼬박 보험료를 내면 소가 죽었을 때 보험금을 준다는 조건이에요. 보상 액수는 큰 소 1백 냥, 중간 소 70냥, 작은 소 40냥으로 정했어요.,농사가 주요 산업이었던 시절, 소는 농민의 ‘재산 1호’였어요. 소는 논밭을 갈고, 물건도 실어 나르는 동물이었죠. 일을 도와주고, 교통수단도 된다는 점에서 오늘날 자동차와 닮았어요. 소가 다치거나 죽으면 주인의 손해도 아주 컸어요. ‘소 보험’은 바로 이점을 겨냥했어요. 대조선보험회사는 농상공부(오늘날 농림축산식품부)의 허가도 받은 튼튼한 회사. 돈을 떼일 위험도 거의 없었습니다.,여기까지 보면, 많은 사람이 소 보험을 반겼을 것 같아요. 그런데 현실은 정반대였어요.볼멘소리가 여기저기서 나왔어요. 곳곳에서 보험에 들기 싫다는 사람과 보험회사 직원 사이에 실랑이가 벌어졌어요. 소한테 세금을 걷는 것과 같다는 말까지 나왔어요. 말도 많고 탈도 많던 소 보험, 혼란을 거듭하다가 결국 석 달 만에 사라지고 말았어요. 이유가 뭘까요?,가장 큰 원인은 낮은 보험금이었어요. 당시의 소 한 마리 가격은 어림잡아 500냥. 40~100냥의 보험금을 받아서 새 소를 사기에는 턱없이 모자랐죠.,정부의 정책도 반감을 샀어요. 보험에 들지 않은 소는 시장에서 사고팔수 없다는 새로운 법을 만든 거예요. 소 보험 가입이 선택이 아니라 반강제적인 일이 되어버렸죠. 혜택은 적고, 져야 할 부담이 큰 상황. 소 보험은 철저히 외면받을 수밖에 없었어요. 우리나라 최초의 보험, 소 보험은 시장이 외면하는 상품은 존재할 수 없다는 것을 증명하면서 역사 속으로 사라졌어요.",,https://cdn.econoi.com/news/photo/202308/40369_20576_054.jpg
증가하는 회색 코뿔소와 블랙·화이트 스완,좌충우돌 시사꼬리,,2023.08.16 16:00,https://cdn.econoi.com/news/photo/202307/40337_20515_2635.jpg,"“우리 사회에 회색 코뿔소와 블랙 스완(검은 백조), 화이트 스완(백조) 등 온갖 위험한 동물이 갈수록 늘어나고 있다. 시스템을 새로 갖추고, 위험에 대비해야 한다.”,여기에 등장하는 동물은 위험과 위기를 상징하는 말이다. 뻔히 알면서도 안이하게 대처하다 겪는 위험, 기후 위기로 이변이 아니라 일상이 되는 위험, 전혀 예상하지 못하다 겪는 큰 위험 등을 뜻한다. 이들 동물에 담긴 경제적, 사회적 의미를 알아보고, 우리가 겪는 위험은 어디에 속하는지 생각해보자.,회색 코뿔소라는 용어는,을 표현하는 말이다. 문제가 있다는 경고가 지속해서 나오고, 다들 이 위험을 알고 있지만 그냥 넘기거나 대책을 세우지 못해 겪는 위험, 알면서도 당하는 위험을 ‘회색 코뿔소’에 비유한다.,,코로나19사태 뒤 인플레이션을 막기 위해 금리가 계속 오르고 있다. 많은 사람이 주택 마련이나 주식 투자를 위해 돈을 대출했고, 그에 따른 이자 부담은 계속 늘어나고 있다. 경기가 나빠 소득은 늘지 않는데, 인플레이션 때문에 금리를 내릴 수도 없다.,소득은 제자리 걸음인데 이자 부담만 커지는 상황. 결과는 뻔히 알지만, 현실적으로 마땅한 대책을 찾기 힘들다.,스완은 당연히 흰색, 그래서 이름도 ‘백조’(하얀색의 새)다. 그런데 1697년 네덜란드의 한 탐험가가 호주 남부에서 이상한 백조를 발견했다. 검은 백조, 바로 ‘블랙 스완’이다.,그때까지 ‘백조는 흰색’으로 알고 있던 사람들은 ‘충격’에 빠졌다. ‘블랙 스완’은 세상 사람들의 상식을 깨고, 놀라움을 주면서 세상에 등장했다.,‘블랙스완’이라는 용어가 세계적으로 알려진 것은 지난 2007년, 미국 투자 전문가인 나심 탈레브가 쓴 ‘블랙스완’이라는 책을 통해서다. 그는 이 책에서 2008년 증시 대폭락과 글로벌 금융위기를 예측했고, 세계 경제가 큰 침체에 빠질 것으로 내다봤다. 이후 예측 불가능에, 무엇을 몰랐는지조차 몰랐던 현상을 통칭해 ‘블랙 스완’이라 부르기 시작했다.,,블랙스완은 예상치 못한 위기를 말한다. 일어날 가능성이 적어서 예측하기 어렵다. 그래서 나타나면 피해가 크다.,미국에서 벌어진 9·11테러, 세월호 참사, 이태원에서 벌어진 핼러윈 데이의 비극, 폭우에 따른 피해, 대형 산불 등 블랙스완의 사례는 많다.,부동산 가격의 폭등과 같은 자산의 거품, 돈 빌리기와 투자자의 지나친 욕심, 통화 정책의 실책 등이 대표적. 어느 정도 예측할 수 있고 공통으로 겪는 일이지만, 적절한 대책을 마련하지 못하거나 시기를 놓쳐 위험에 빠지는 상황이다.,최근 빈번하게 경험하는 자연 재해도 화이트 스완으로 볼 수 있다. 기후 위기로 기상이변은 더 이상 이상이 아니라고 하면서도, 적절한 대책을 세우지 못해 큰 재난으로 이어진다. 개인으로 본다면 도박이나 음주, 과소비가 가져오는 위험을 잘 알면서도 되풀이하는 실수도 화이트 스완으로 볼 수 있다.,1) 지난 2017년 유치한 뒤, 여러 차례 준비가 부족하다는 지적이 있었음에도 결국 문제가 줄이은 제25회 새만금 잼버리. 어떤 위험으로 볼 수 있을까요?,2) 갑작스런 폭우로 지하 주차장이 물에 잠겨 큰 인명피해를 본 뒤 수많은 대책이 나왔어요. 그런데도 올해 지하차도에서 참사가 반복됐어요. 이는 어떤 위험으로 볼 수 있을까요?",,https://cdn.econoi.com/news/photo/202308/40406_20639_5921.png
국가에도 신용등급이 있다,꼭! Easy 경제,,2023.08.16 16:26,https://cdn.econoi.com/news/photo/202307/40337_20515_2635.jpg,"국가신용등급 /,미국의 신용등급 하락 /,나라 부채(빚) 증가와 정치권 대립 심화,네. 신용을 평가해서 등급이나 점수로 매기는 건 보통은 개인을 대상으로 한 서비스입니다. 신용등급이나 신용점수가 높으면 그 사람은 금융에서 믿을만하다는 뜻입니다. 낮으면 그 반대죠.,국가도 마찬가지예요. 국가는 세금을 거둬 나라 살림을 꾸려가요 (이것을 재정 활동이라고 해요). 세금을 거두는 게 쉬운 일은 아니다 보니 국가 살림은 늘 넉넉하지 않아요. 학교를 짓고, 다리와 도로를 만드는 등 쓸 곳은 정말 많거든요. 나라 살림살이에서 돈이 부족하면 세금을 더 걷거나, 채권을 발행해서 나중에 갚기로 하고 외국이나 투자자로부터 돈을 빌리기도 해요.,이럴 때 적용하는 게 국가신용등급이에요. 신용등급이 낮으면 국가는 더욱 많은 이자를 부담해야 합니다. 신뢰도가 낮은 만큼, 이자를 많이 지급해서 대가로 삼는 셈이죠.,국가신용등급은 여러 곳에서 평가하고 결정하는데, 세계에서 인정받는 3대 평가회사가 있어요. S&P(Standard & Poor’s Services, 스탠더드앤드푸어스), 무디스(Moody’s), 피치(Fitch)입니다.,세계 3대 신용평가사의 하나인 피치가 미국 신용등급을 ‘AAA’에서 ‘AA+’로강등(낮춤)했어요. 강등의 가장 큰 이유는 빚이 너무 늘어난 것. 2018년 3월 미국의 빚은 21.1조 달러(2경 7,430조 원)였는데, 5년 지난 2023년 6월 현재 32.3조 달러(4경 1,990조 원)로 많이 늘어났어요. 또 미국 정치권이 재정과 부채 문제를 두고 심각하게 대립하고 있는 것도 피치가 미국 신용등급을 낮춘 큰 이유로 꼽힙니다.,피치의 평가 기준에서 가장 높은 신용등급은 AAA입니다. 그다음은 순서대로 AA+, AA, AA-, A+, A, A- 순이에요. 투자자 사이에서 BB+ 이하부터는 ‘투자 유의’에 해당합니다. 현재 피치 기준으로 AAA 등급인 나라는 호주, 캐나다, 덴마크, 독일 등 13 개국입니다. 우리나라는 AA-등급(우량). 지난 2012년 9월부터 이 등급을 유지하고 있어요.",,
"한국 경제 75년, 한강의 기적",반사경,,2023.08.16 17:29,https://cdn.econoi.com/news/photo/202307/40337_20515_2635.jpg,"- 벤가릴 메논(1897~1974). 1955년 10월, UN한국재건위원회(UNKRA) 회의에서,전쟁이 멈춘 1953년, 우리나라 국민 한 사람의 1년 소득은 단돈 67달러였어요. 공장과 도로 같은 시설은 대부분 부서져 제 기능을 못 했죠. 외부의 도움이 절실한 상황. 하지만 얼마 전까지 총성이 오가던 나라에 선뜻 투자하겠다는 외국(인)은 별로 없었어요. 틈틈이 곡식과 물자를 대줄 뿐이었죠. 이 무렵의 세계은행 (IBRD)은 한국보다 필리핀, 버마(미얀마)가 발전 가능성이 더 높다고 내다봤어요. “한국은 아마 안 될 거야.” 많은 사람이 이렇게 생각했죠.,남은 방법은 단 하나. 우리나라 사람들이 해외로 직접 나가 돈을 벌어오는 것이었어요. 한국인들은 외국으로 떠나서 남자들은 광부, 여자들은 간호사가 되어 일했어요. 이들이 부친 돈은 귀중한 외화 수입으로 경제발전의 밑거름이 됐어요. 길을 닦고, 회사를 짓고, 자동차도 만들었죠. 벌어오는것 못지않게 파는 데도 힘썼어요. 우리나라 수출품은 오징어와 시멘트에서 신발·인형으로, 다시 텔레비전과 대형 선박으로 발전해 갔죠. 온 나라가 노력한 결과, 한국 경제는 쑥쑥 자라나기 시작했어요. 1960~90년 사이 30년간 우리나라 경제성장률은 매년 평균 9%를 넘었어요. 1995년에는 마침내 국민 한 사람 1년 소득이 1만 달러에 이르렀죠.,2019년, 우리나라는 30-50 클럽 회원국이 됐어요. 이 조직은 UN이나 WHO처럼 실제로 활동하는 국제기구는 아니에요.,하지만 여기에 속한 국가가된 것은 ‘선진국 인증’이나 다름 없죠. 클럽 가입이 더욱 값진 이유 하나 더. 다른 회원국은 백 년 넘게 세계를 호령하던 나라들이에요. 사람으로 빗대자면 ‘금수저’. 바닥부터 출발해서 자수성가한 ‘흙수저’ 나라는 한국뿐이에요. 우리 국민의 저력과 끈기가 빚어낸 결과죠.,1인당 국민소득 30,000달러 이상, 인구 5,000만 명 이상의 두 가지 조건을 충족한 국가들의 모임. 세계 200여 개 나라 가운데 일본, 미국, 영국, 독일, 프랑스, 이탈리아, 한국 단 7개국이 여기에 해당한다.,",,
